============================================
#Welcome Message
===========================================
Welcome to the MySQL monitor.  Commands end with ; or \g.
Your MySQL connection id is 17
Server version: 8.0.26 MySQL Community Server - GPL

Copyright (c) 2000, 2021, Oracle and/or its affiliates.

Oracle is a registered trademark of Oracle Corporation and/or its
affiliates. Other names may be trademarks of their respective
owners.

Type 'help;' or '\h' for help. Type '\c' to clear the current input statement.

mysql> Welcome to EmployeePayRollDataBase
==============================================================
#UC1-->Created PayrollService
==============================================================
mysql>  create database payroll_service;
ERROR 1007 (HY000): Can't create database 'payroll_service'; database exists
mysql> show databases;
+--------------------+
| Database           |
+--------------------+
| addressbook        |
| balu               |
| client             |
| dance              |
| employee_payroll   |
| information_schema |
| mysql              |
| payroll_service    |
| performance_schema |
| sys                |
+--------------------+
10 rows in set (0.00 sec)
=================================================================================================
#uc2---->createdTable
=================================================================================================
mysql> use payroll_service;
Database changed
mysql> create table employee_payroll(
    -> id int auto_increment primary key,
    -> name varchar(150) not null,
    -> salary decimal not null,
    -> start_date date );
Query OK, 0 rows affected (0.51 sec)

mysql> desc employee_payroll;
+------------+---------------+------+-----+---------+----------------+
| Field      | Type          | Null | Key | Default | Extra          |
+------------+---------------+------+-----+---------+----------------+
| id         | int           | NO   | PRI | NULL    | auto_increment |
| name       | varchar(150)  | NO   |     | NULL    |                |
| salary     | decimal(10,0) | NO   |     | NULL    |                |
| start_date | date          | YES  |     | NULL    |                |
+------------+---------------+------+-----+---------+----------------+
4 rows in set (0.20 sec)
=====================================================================================================
#uc3---->insertOperation
=====================================================================================================

mysql> insert into employee_payroll(name, salary, start_date)values("bala", 30000, "2021-10-4");
Query OK, 1 row affected (0.09 sec)

mysql> insert into employee_payroll(name, salary, start_date)values("bannu", 50000, "2021-10-4");
Query OK, 1 row affected (0.11 sec)

mysql> select * from employee_payroll;
+----+-------+--------+------------+
| id | name  | salary | start_date |
+----+-------+--------+------------+
|  1 | bala  |  30000 | 2021-10-04 |
|  2 | bannu |  50000 | 2021-10-04 |
+----+-------+--------+------------+
2 rows in set (0.00 sec)
=======================================================================================================
#uc4--------->selectOperation
=======================================================================================================
mysql> select * from employee_payroll;
+----+-------+--------+------------+
| id | name  | salary | start_date |
+----+-------+--------+------------+
|  1 | bala  |  30000 | 2021-10-04 |
|  2 | bannu |  50000 | 2021-10-04 |
+----+-------+--------+------------+
2 rows in set (0.00 sec)

mysql> insert into employee_payroll(name, salary, start_date)values("pandu", 60000, "2021-10-4");
Query OK, 1 row affected (0.10 sec)

mysql> select * from employee_payroll;
+----+-------+--------+------------+
| id | name  | salary | start_date |
+----+-------+--------+------------+
|  1 | bala  |  30000 | 2021-10-04 |
|  2 | bannu |  50000 | 2021-10-04 |
|  3 | pandu |  60000 | 2021-10-04 |
+----+-------+--------+------------+
3 rows in set (0.06 sec)

==========================================================================================================
#uc5--->WhereOperation
==========================================================================================================
mysql> insert into employee_payroll(name, salary, start_date)values("phani", 70000, "2018-7-21");
Query OK, 1 row affected (0.10 sec)

mysql> insert into employee_payroll(name, salary, start_date)values("kiran", 20000, "2019-6-12");
Query OK, 1 row affected (0.08 sec)

mysql> insert into employee_payroll(name, salary, start_date)values("swamy", 40000, "2012-02-18");
Query OK, 1 row affected (0.11 sec)

mysql> select * from employee_payroll;
+----+-------+--------+------------+
| id | name  | salary | start_date |
+----+-------+--------+------------+
|  1 | bala  |  30000 | 2021-10-04 |
|  2 | bannu |  50000 | 2021-10-04 |
|  3 | pandu |  60000 | 2021-10-04 |
|  4 | phani |  70000 | 2018-07-21 |
|  5 | kiran |  20000 | 2019-06-12 |
|  6 | swamy |  40000 | 2012-02-18 |
+----+-------+--------+------------+
6 rows in set (0.02 sec)

mysql> select salary from employee_payroll where name='pandu';
+--------+
| salary |
+--------+
|  60000 |
+--------+
1 row in set (0.00 sec)

mysql> select *from employee_payroll where start_date between cast('2018-01-01'as date) and date(now())
    -> ;
+----+-------+--------+------------+
| id | name  | salary | start_date |
+----+-------+--------+------------+
|  1 | bala  |  30000 | 2021-10-04 |
|  2 | bannu |  50000 | 2021-10-04 |
|  3 | pandu |  60000 | 2021-10-04 |
|  4 | phani |  70000 | 2018-07-21 |
|  5 | kiran |  20000 | 2019-06-12 |
+----+-------+--------+------------+
5 rows in set (0.00 sec)
===================================================================================================
#UC6------->AddGender
====================================================================================================
mysql> alter table employee_payroll add gender char not null after name;
Query OK, 0 rows affected (1.63 sec)
Records: 0  Duplicates: 0  Warnings: 0

mysql> select * from employee_payroll;
+----+-------+--------+--------+------------+
| id | name  | gender | salary | start_date |
+----+-------+--------+--------+------------+
|  1 | bala  |        |  30000 | 2021-10-04 |
|  2 | bannu |        |  50000 | 2021-10-04 |
|  3 | pandu |        |  60000 | 2021-10-04 |
|  4 | phani |        |  70000 | 2018-07-21 |
|  5 | kiran |        |  20000 | 2019-06-12 |
|  6 | swamy |        |  40000 | 2012-02-18 |
+----+-------+--------+--------+------------+
6 rows in set (0.00 sec)

mysql> update employee_payroll set gender ='m' where name = 'bala';
Query OK, 1 row affected (0.07 sec)
Rows matched: 1  Changed: 1  Warnings: 0

mysql> update employee_payroll set gender ='m' where name = 'bannu';
Query OK, 1 row affected (0.16 sec)
Rows matched: 1  Changed: 1  Warnings: 0

mysql> update employee_payroll set gender ='m' where name = 'pandu';
Query OK, 1 row affected (0.10 sec)
Rows matched: 1  Changed: 1  Warnings: 0

mysql> update employee_payroll set gender ='m' where name = 'phani';
Query OK, 1 row affected (0.15 sec)
Rows matched: 1  Changed: 1  Warnings: 0

mysql> update employee_payroll set gender ='m' where name = 'kiran';
Query OK, 1 row affected (0.06 sec)
Rows matched: 1  Changed: 1  Warnings: 0

mysql> update employee_payroll set gender ='m' where name = 'swamy';
Query OK, 1 row affected (0.24 sec)
Rows matched: 1  Changed: 1  Warnings: 0

mysql> select * from employee_payroll;
+----+-------+--------+--------+------------+
| id | name  | gender | salary | start_date |
+----+-------+--------+--------+------------+
|  1 | bala  | m      |  30000 | 2021-10-04 |
|  2 | bannu | m      |  50000 | 2021-10-04 |
|  3 | pandu | m      |  60000 | 2021-10-04 |
|  4 | phani | m      |  70000 | 2018-07-21 |
|  5 | kiran | m      |  20000 | 2019-06-12 |
|  6 | swamy | m      |  40000 | 2012-02-18 |
+----+-------+--------+--------+------------+
6 rows in set (0.00 sec)



